{"$schema":"https://json-schema.org/draft/2020-12/schema","$id":"https://vexil.dev/release/schemas/release-set-selection-1.0.schema.json","type":"object","additionalProperties":false,"required":["$schema","$id","schemaVersion","recordKind","selectionId","status","sourceCommit","includedUnits","excludedUnits","releaseBoundary"],"properties":{"$schema":{"const":"https://json-schema.org/draft/2020-12/schema"},"$id":{"pattern":"^https://vexil.dev/release/decisions/[a-z0-9][a-z0-9-]*[.]json$"},"schemaVersion":{"const":"1.0"},"recordKind":{"const":"release-set-selection"},"selectionId":{"pattern":"^[a-z0-9][a-z0-9-]*$"},"status":{"const":"rehearsal-selected"},"sourceCommit":{"pattern":"^[0-9a-f]{40}$"},"includedUnits":{"type":"array","minItems":1,"items":{"$ref":"#/$defs/included"}},"excludedUnits":{"type":"array","minItems":1,"items":{"$ref":"#/$defs/excluded"}},"releaseBoundary":{"const":"selection-only; no Manifest, approval, Run, tag, registry, deployment, or publication authority"}},"$defs":{"included":{"type":"object","additionalProperties":false,"required":["unitId","sourceCommit","previousVersion","proposedVersion","versionRationaleId","canonicalTag","target","cleanConsumerPlan"],"properties":{"unitId":{"pattern":"^[a-z0-9][a-z0-9-]*$"},"sourceCommit":{"pattern":"^[0-9a-f]{40}$"},"previousVersion":{"type":"string"},"proposedVersion":{"type":"string"},"versionRationaleId":{"pattern":"^[a-z0-9][a-z0-9-]*$"},"canonicalTag":{"pattern":"^[A-Za-z0-9._/-]+$"},"target":{"type":"object","additionalProperties":false,"required":["kind","name","mandatory"],"properties":{"kind":{"type":"string"},"name":{"type":"string"},"mandatory":{"const":true}}},"cleanConsumerPlan":{"type":"string","minLength":1}}},"excluded":{"type":"object","additionalProperties":false,"required":["unitId","reason","nextAction"],"properties":{"unitId":{"pattern":"^[a-z0-9][a-z0-9-]*$"},"reason":{"type":"string","minLength":1},"nextAction":{"type":"string","minLength":1}}}}}
