{"$schema":"https://json-schema.org/draft/2020-12/schema","$id":"https://vexil.dev/release/decisions/first-recovered-release-set-2026-07-26.json","schemaVersion":"1.0","recordKind":"release-set-selection","selectionId":"first-recovered-release-set-2026-07-26","status":"rehearsal-selected","sourceCommit":"99e2afef4d48ab35ec61e8b23a9c0d6c210e275f","includedUnits":[{"unitId":"vexil-runtime-go","sourceCommit":"99e2afef4d48ab35ec61e8b23a9c0d6c210e275f","previousVersion":"0.1.0","proposedVersion":"0.1.1","versionRationaleId":"vexil-runtime-go-0-1-1","canonicalTag":"packages/runtime-go/v0.1.1","target":{"kind":"go-module","name":"github.com/vexil-lang/vexil/packages/runtime-go","mandatory":true},"cleanConsumerPlan":"After the approved Run, retrieve github.com/vexil-lang/vexil/packages/runtime-go@v0.1.1 from a clean Go module cache, run go test, verify the resolved module version, and record proxy propagation separately."}],"excludedUnits":[{"unitId":"vexil-codegen-go","reason":"crates.io identity and custody are not established for this exact package.","nextAction":"Establish target-scoped custody and a separately evidenced rationale."},{"unitId":"vexil-codegen-py","reason":"crates.io identity and custody are not established for this exact package.","nextAction":"Establish target-scoped custody and a separately evidenced rationale."},{"unitId":"vexil-codegen-rust","reason":"crates.io identity and custody are not established for this exact package.","nextAction":"Establish target-scoped custody and a separately evidenced rationale."},{"unitId":"vexil-codegen-ts","reason":"crates.io identity and custody are not established for this exact package.","nextAction":"Establish target-scoped custody and a separately evidenced rationale."},{"unitId":"vexil-lang","reason":"crates.io identity and custody are not established for this exact package.","nextAction":"Establish target-scoped custody and a separately evidenced rationale."},{"unitId":"vexil-runtime","reason":"crates.io identity and custody are not established for this exact package.","nextAction":"Establish target-scoped custody and a separately evidenced rationale."},{"unitId":"vexil-runtime-py","reason":"Exact PyPI project identity and trusted-publisher custody remain unresolved.","nextAction":"Resolve the PyPI identity before selecting a Python target."},{"unitId":"vexil-runtime-ts","reason":"The checked-in version and public npm history remain divergent.","nextAction":"Resolve source/public version drift and target custody."},{"unitId":"vexil-store","reason":"crates.io identity and dependency release order are not established for this exact package.","nextAction":"Establish target custody and dependency evidence."},{"unitId":"vexilc","reason":"crates.io identity and every publish-before dependency target are not established.","nextAction":"Establish target custody and dependency evidence."}],"releaseBoundary":"selection-only; no Manifest, approval, Run, tag, registry, deployment, or publication authority"}
